{
  "$schema": "./target-catalog.schema.json",
  "schema_version": 1,
  "max_cost_class": "premium",
  "allow_cross_provider": false,
  "targets": [
    {
      "id": "fast",
      "label": "Luna · Medium",
      "provider": "openai-codex",
      "model": "gpt-5.6-luna",
      "reasoning_effort": "medium",
      "cost_class": "low"
    },
    {
      "id": "balanced",
      "label": "Sol · Medium",
      "provider": "openai-codex",
      "model": "gpt-5.6-sol",
      "reasoning_effort": "medium",
      "cost_class": "standard"
    },
    {
      "id": "strong",
      "label": "Sol · High",
      "provider": "openai-codex",
      "model": "gpt-5.6-sol",
      "reasoning_effort": "high",
      "cost_class": "premium"
    },
    {
      "id": "premium",
      "label": "Sol · XHigh",
      "provider": "openai-codex",
      "model": "gpt-5.6-sol",
      "reasoning_effort": "xhigh",
      "cost_class": "premium"
    }
  ]
}
